{
  "schema_version": "1.0.0",
  "package_version": "1.0.0",
  "target_framework": "VCGF",
  "target_framework_version": "1.3.0",
  "status": "final-integration-candidate",
  "dependency_semantics": "review-relationships-not-automatic-activation",
  "components": [
    {
      "id": "VCGF-UI-COMP-001",
      "component": "DesignSystemPrimitives",
      "title": "نظام التصميم والعناصر الأساسية",
      "priority": "P0",
      "version": "0.2.0",
      "status": "final-integration-candidate",
      "path": "standards/VCGF-UI-COMP-001-DesignSystemPrimitives.md",
      "purpose": "توحيد لغة الواجهة وحالاتها دون فرض قالب واحد على جميع المنتجات. يصبح القرار البصري معرّفًا مركزيًا وقابلًا للاختبار، وتبقى المهمة الفعلية للمستخدم هي التي تحدد الكثافة والتخطيط.",
      "applies_when": "ينطبق عند إنشاء أو تعديل واجهات تفاعلية متكررة أو بناء أكثر من شاشة تتشارك عناصر أساسية. في مشروع قائم يبدأ بجرد المكوّنات الموجودة وإعادة استخدامها، لا باستبدالها تلقائيًا.",
      "not_applicable_when": "لا يفرض مكتبة CSS جديدة على خدمة API فقط، ولا يستبدل هوية معتمدة، ولا يحمّل تطبيقًا بسيطًا جميع عناصر مكتبة مؤسسية. السمات الإضافية لا تُعرض للمستخدم قبل اكتمالها.",
      "dependencies": [],
      "external_dependencies": [],
      "package_ids": [
        "SHADCN",
        "RADIX",
        "REACT_ARIA"
      ],
      "settings": [
        {
          "key": "theme",
          "type": "string",
          "default": "system",
          "scope": "tenant/user",
          "constraints": "السماح فقط بالسمات المكتملة والمختبرة؛ light أو dark أو system."
        },
        {
          "key": "density",
          "type": "string",
          "default": "adaptive",
          "scope": "tenant/user",
          "constraints": "comfortable أو compact أو adaptive؛ لا تخفض مساحة اللمس تحت سياسة الوصولية."
        },
        {
          "key": "direction",
          "type": "string",
          "default": "locale",
          "scope": "system",
          "constraints": "مشتق من لغة الواجهة المعلنة؛ لا يحدد لغة المحتوى بنفسه."
        },
        {
          "key": "motion",
          "type": "string",
          "default": "respect-system",
          "scope": "system/user",
          "constraints": "تعطيل الحركة غير الضرورية عند طلب تقليل الحركة."
        },
        {
          "key": "focusStyle",
          "type": "string",
          "default": "visible",
          "scope": "system",
          "constraints": "لا يجوز إلغاء مؤشر التركيز لاعتبارات تجميلية."
        },
        {
          "key": "touchTargetPx",
          "type": "integer",
          "default": 44,
          "scope": "system/tenant",
          "constraints": "هدف تصميم مفضّل وليس ادعاء أنه الحد الإلزامي العام في WCAG؛ يوثق أي استثناء."
        },
        {
          "key": "tokenRevision",
          "type": "string",
          "default": "1",
          "scope": "system",
          "constraints": "إصدار مستقل للتوكنز لتتبع التغييرات وعدم تحميل قيم غير متوافقة."
        },
        {
          "key": "allowTenantBranding",
          "type": "boolean",
          "default": false,
          "scope": "system",
          "constraints": "لا يسمح للمستأجر بإلغاء التباين أو حالات الخطأ أو هوية الأزرار الخطرة."
        }
      ],
      "requirement_count": 12,
      "acceptance_count": 12
    },
    {
      "id": "VCGF-UI-COMP-002",
      "component": "SmartDataGrid",
      "title": "الجداول الذكية المتقدمة",
      "priority": "P0",
      "version": "0.2.0",
      "status": "final-integration-candidate",
      "path": "standards/VCGF-UI-COMP-002-SmartDataGrid.md",
      "purpose": "تمكين المستخدم من فحص البيانات ومقارنتها واتخاذ إجراءات على نطاق معلوم، مع الحفاظ على دقة النتائج والأداء والصلاحيات عند نمو عدد السجلات.",
      "applies_when": "ينطبق على قوائم تشغيلية تحتاج فرزًا أو تصفية أو تخصيص أعمدة أو إجراءات على صفوف. يبدأ بجدول دلالي بسيط ثم يفعّل قدرات إضافية بحسب حجم البيانات والمهمة.",
      "not_applicable_when": "لا يستخدم بدل صفحات القراءة أو تدفقات الموافقة التي تحتاج سياقًا قصصيًا. لا تُضاف افتراضيًا خصائص تعديل خلايا أو تجميع أو تصدير لم يطلبها نطاق العمل.",
      "dependencies": [
        "VCGF-UI-COMP-001",
        "VCGF-UI-COMP-004",
        "VCGF-UI-COMP-008",
        "VCGF-UI-COMP-012"
      ],
      "external_dependencies": [
        "calendar",
        "searchable_select"
      ],
      "package_ids": [
        "TANSTACK_TABLE",
        "TANSTACK_QUERY",
        "AG_GRID"
      ],
      "settings": [
        {
          "key": "pageSize",
          "type": "integer",
          "default": 25,
          "scope": "tenant/user",
          "constraints": "خيارات 10 و25 و50 و100 ضمن حد الخادم."
        },
        {
          "key": "paginationMode",
          "type": "string",
          "default": "server",
          "scope": "system",
          "constraints": "client لمجموعة كاملة صغيرة ومعلومة فقط؛ يجب التصريح بنمط البيانات."
        },
        {
          "key": "selectionScope",
          "type": "string",
          "default": "visible-page",
          "scope": "system/user",
          "constraints": "اختيار جميع النتائج يحتاج إجراء صريحًا ونطاقًا مثبتًا من الخادم."
        },
        {
          "key": "density",
          "type": "string",
          "default": "adaptive",
          "scope": "tenant/user",
          "constraints": "لا يغيّر القيم أو حقوق العرض."
        },
        {
          "key": "persistColumns",
          "type": "boolean",
          "default": true,
          "scope": "tenant/user",
          "constraints": "يحفظ معرفات الأعمدة وإصدار المخطط لا بيانات الصفوف."
        },
        {
          "key": "allowInlineEdit",
          "type": "boolean",
          "default": false,
          "scope": "system/tenant",
          "constraints": "يتطلب عقد حفظ وتحقق وصلاحية مستقلة لكل حقل."
        },
        {
          "key": "exportEnabled",
          "type": "boolean",
          "default": false,
          "scope": "system/tenant",
          "constraints": "إذن تصدير مستقل؛ لا يكفي إذن العرض."
        },
        {
          "key": "virtualization",
          "type": "string",
          "default": "measured",
          "scope": "system",
          "constraints": "تُفعّل بعد قياس مع بديل وصولي واختبار التركيز."
        }
      ],
      "requirement_count": 12,
      "acceptance_count": 12
    },
    {
      "id": "VCGF-UI-COMP-003",
      "component": "SmartFormFields",
      "title": "النماذج والتحقق الذكي الموحد",
      "priority": "P0",
      "version": "0.2.0",
      "status": "final-integration-candidate",
      "path": "standards/VCGF-UI-COMP-003-SmartFormFields.md",
      "purpose": "تقليل أخطاء الإدخال وحفظ جهد المستخدم، مع فصل قواعد البيانات والأعمال عن تجميع الحقول وطريقة عرضها والتحقق المبكر داخل المتصفح.",
      "applies_when": "ينطبق على إنشاء السجلات وتعديلها والبحث المتقدم والنماذج المشروطة. يوسع النموذج القائم ولا ينقل المشروع إلى مكتبة جديدة لمجرد التشابه البصري.",
      "not_applicable_when": "لا يستبدل تحقق الخادم، ولا يطلب حقولًا لا يحتاجها الإجراء، ولا يتحول كل نموذج قصير إلى مولّد نماذج ديناميكي معقد.",
      "dependencies": [
        "VCGF-UI-COMP-001",
        "VCGF-UI-COMP-008",
        "VCGF-UI-COMP-012"
      ],
      "external_dependencies": [
        "calendar",
        "searchable_select"
      ],
      "package_ids": [
        "REACT_HOOK_FORM",
        "ZOD",
        "TANSTACK_FORM"
      ],
      "settings": [
        {
          "key": "validationMode",
          "type": "string",
          "default": "blur-then-change",
          "scope": "system/tenant",
          "constraints": "تحقق عند الخروج ثم عند تعديل حقل أخطأ؛ القاعدة تتكيف مع نوع الحقل."
        },
        {
          "key": "showErrorSummary",
          "type": "boolean",
          "default": true,
          "scope": "system",
          "constraints": "للنماذج الطويلة أو متعددة الأخطاء؛ يربط كل خطأ بحقل."
        },
        {
          "key": "preserveValuesOnError",
          "type": "boolean",
          "default": true,
          "scope": "system",
          "constraints": "لا يحفظ كلمات المرور في التخزين الدائم."
        },
        {
          "key": "requiredIndicator",
          "type": "string",
          "default": "text-and-symbol",
          "scope": "tenant",
          "constraints": "التسمية متاحة ولا تعتمد على النجمة أو اللون وحدهما."
        },
        {
          "key": "submitPolicy",
          "type": "string",
          "default": "single-inflight",
          "scope": "system",
          "constraints": "لا يغني عن idempotency للعمليات ذات الأثر."
        },
        {
          "key": "manualInput",
          "type": "boolean",
          "default": true,
          "scope": "tenant",
          "constraints": "يمكن تقييده فقط عندما يستلزم نوع الحقل ذلك وببديل متاح."
        },
        {
          "key": "conditionalValuePolicy",
          "type": "string",
          "default": "explicit-per-field",
          "scope": "system",
          "constraints": "يُحسم حفظ أو حذف قيمة الحقل المخفي ولا يترك ضمنيًا."
        },
        {
          "key": "unsavedChangesGuard",
          "type": "boolean",
          "default": true,
          "scope": "tenant",
          "constraints": "مناسب للنماذج ذات التعديل؛ لا يعترض القراءة فقط."
        }
      ],
      "requirement_count": 12,
      "acceptance_count": 12
    },
    {
      "id": "VCGF-UI-COMP-004",
      "component": "AdvancedFilterBuilder",
      "title": "البحث والفلاتر المحفوظة",
      "priority": "P0",
      "version": "0.2.0",
      "status": "final-integration-candidate",
      "path": "standards/VCGF-UI-COMP-004-AdvancedFilterBuilder.md",
      "purpose": "جعل نطاق النتائج مفهومًا وقابلًا للتكرار والمشاركة المصرح بها، بدل مجموعة فلاتر تخفي سبب ظهور البيانات أو تغيّر معنى الاستعلام بين الشاشات.",
      "applies_when": "ينطبق على قوائم تحتاج أكثر من معيار بحث أو طرق عرض متكررة. يدعم فلاتر بسيطة أولًا، ثم مجموعات AND وOR فقط عند الحاجة المؤكدة.",
      "not_applicable_when": "لا يضيف محرر شروط متداخلًا إلى بحث بسيط، ولا يسمح بكتابة SQL أو أسماء أعمدة حرة، ولا يضع استعلامات حساسة تلقائيًا في عنوان الصفحة.",